{
  "planId": "plan-e810c8cf2fc667011ff17e280098bdb6",
  "state": "partial",
  "effects": [
    "buffer"
  ],
  "changes": [
    {
      "outcome": "applied",
      "path": "src/auth.ts",
      "revision": "b1-30e217dafba8bae4b210e802479fb377"
    },
    {
      "outcome": "exists",
      "path": "src/util/format.ts"
    }
  ]
}
